{
  "identity": {
    "android": "8.1.0",
    "brand": "Xiaomi",
    "codename": "jasmine_sprout",
    "model": "Mi A2",
    "platform": "sdm660"
  },
  "provenance": {
    "source_file": "devices/xiaomi/jasmine_sprout.prop"
  },
  "schema": "hico.device.v1",
  "source": {
    "kind": "oem-firmware-dump",
    "url": "https://dumps.tadiphone.dev/dumps/xiaomi/jasmine/-/tree/jasmine-user-8.1.0-OPM1.171019.011-8.9.20-release-keys"
  },
  "thermal": {
    "artifact_count": 4,
    "artifacts": [
      {
        "category": "thermal",
        "format": "thermal-engine-text",
        "max_trip_c": null,
        "name": "thermal-engine-map.conf",
        "parser": "thermal-engine-text-v2",
        "path": "devices/xiaomi/jasmine_sprout/thermal/thermal-engine-map.conf",
        "sections": 4,
        "sha256": "151a92e7104842bdd37bb5bd9065f4321f80e70cd1118347b5eef1b812335df5",
        "shutdown_c": null,
        "size": 125,
        "storage": "repository-artifact"
      },
      {
        "category": "thermal",
        "format": "thermal-engine-text",
        "max_trip_c": 95.0,
        "name": "thermal-engine-normal.conf",
        "parser": "thermal-engine-text-v2",
        "path": "devices/xiaomi/jasmine_sprout/thermal/thermal-engine-normal.conf",
        "sections": 30,
        "sha256": "99f37759a8dc93db3b0e9cef2a3a44e3086cdb36da11585b611fb834bf49c00b",
        "shutdown_c": null,
        "size": 5285,
        "storage": "repository-artifact"
      },
      {
        "category": "thermal",
        "format": "thermal-engine-text",
        "max_trip_c": 95.0,
        "name": "thermal-engine-video.conf",
        "parser": "thermal-engine-text-v2",
        "path": "devices/xiaomi/jasmine_sprout/thermal/thermal-engine-video.conf",
        "sections": 31,
        "sha256": "88fd2ccb7aca35cd71b6907c616c1ee4cb56af0865e6fa858ec7f0d77ec0ee07",
        "shutdown_c": null,
        "size": 5499,
        "storage": "repository-artifact"
      },
      {
        "category": "thermal",
        "format": "text",
        "max_trip_c": null,
        "name": "thermal-engine.conf",
        "parser": null,
        "path": "devices/xiaomi/jasmine_sprout/thermal/thermal-engine.conf",
        "sections": 0,
        "sha256": "c32b39af7a19759a7db7f8b2d92d069a0534848aa7a195ca2cec24aa6c317cb3",
        "shutdown_c": null,
        "size": 84,
        "storage": "repository-artifact"
      }
    ],
    "config_names": [
      "thermal-engine-map.conf",
      "thermal-engine-normal.conf",
      "thermal-engine-video.conf",
      "thermal-engine.conf"
    ],
    "mi_thermald": false,
    "services": [
      "thermal-engine",
      "thermal-hal-1-0"
    ]
  }
}
