{
  "identity": {
    "android": "7.1.1",
    "brand": "Xiaomi",
    "codename": "achilles",
    "model": "Achilles",
    "platform": "sdm660"
  },
  "provenance": {
    "source_file": "devices/xiaomi/achilles.prop"
  },
  "schema": "hico.device.v1",
  "source": {
    "kind": "oem-firmware-dump",
    "url": "https://dumps.tadiphone.dev/dumps/xiaomi/achilles/-/tree/achilles-user-7.1.1-NMF26X-7.6.14-release-keys"
  },
  "thermal": {
    "artifact_count": 2,
    "artifacts": [
      {
        "category": "thermal",
        "format": "opaque-binary",
        "max_trip_c": null,
        "name": "thermal-engine-sdm660.conf",
        "parser": null,
        "path": "devices/xiaomi/achilles/thermal/thermal-engine-sdm660.conf",
        "sections": 0,
        "sha256": "5e5a1c1330cd2c228bbea869aa769f9e1917b8109b7059f90ba87a628f4528b3",
        "shutdown_c": null,
        "size": 96,
        "storage": "repository-artifact"
      },
      {
        "category": "thermal",
        "format": "text",
        "max_trip_c": null,
        "name": "thermal-engine.conf",
        "parser": null,
        "path": "devices/xiaomi/achilles/thermal/thermal-engine.conf",
        "sections": 0,
        "sha256": "c32b39af7a19759a7db7f8b2d92d069a0534848aa7a195ca2cec24aa6c317cb3",
        "shutdown_c": null,
        "size": 84,
        "storage": "repository-artifact"
      }
    ],
    "config_names": [
      "thermal-engine-sdm660.conf",
      "thermal-engine.conf"
    ],
    "mi_thermald": false,
    "services": []
  }
}
