{
  "identity": {
    "android": "9",
    "brand": "Xiaomi",
    "codename": "whyred",
    "model": "Redmi Note 5",
    "platform": "sdm660"
  },
  "provenance": {
    "source_file": "devices/xiaomi/whyred.prop"
  },
  "schema": "hico.device.v1",
  "source": {
    "kind": "oem-firmware-dump",
    "url": "https://dumps.tadiphone.dev/dumps/xiaomi/whyred/-/tree/whyred-user-9-PKQ1.180904.001-V12.0.2.0.PEIMIXM-release-keys"
  },
  "thermal": {
    "artifact_count": 3,
    "artifacts": [
      {
        "category": "thermal",
        "format": "thermal-engine-text",
        "max_trip_c": null,
        "name": "thermal-engine-map.conf",
        "parser": "thermal-engine-text-v2",
        "path": "devices/xiaomi/whyred/thermal/thermal-engine-map.conf",
        "sections": 12,
        "sha256": "2510a6f562e9633614bf04e35d3b5a52aecd652cb7664ad2b7f2d911af13645b",
        "shutdown_c": null,
        "size": 378,
        "storage": "repository-artifact"
      },
      {
        "category": "thermal",
        "format": "thermal-engine-text",
        "max_trip_c": 95.0,
        "name": "thermal-engine-normal.conf",
        "parser": "thermal-engine-text-v2",
        "path": "devices/xiaomi/whyred/thermal/thermal-engine-normal.conf",
        "sections": 28,
        "sha256": "ee71d0930ed3c0622a517ce988aaee5025da50b3b272835e5f49f8f4a6758e3d",
        "shutdown_c": null,
        "size": 5337,
        "storage": "repository-artifact"
      },
      {
        "category": "thermal",
        "format": "text",
        "max_trip_c": null,
        "name": "thermal-engine.conf",
        "parser": null,
        "path": "devices/xiaomi/whyred/thermal/thermal-engine.conf",
        "sections": 0,
        "sha256": "c32b39af7a19759a7db7f8b2d92d069a0534848aa7a195ca2cec24aa6c317cb3",
        "shutdown_c": null,
        "size": 84,
        "storage": "repository-artifact"
      }
    ],
    "config_names": [
      "thermal-engine-map.conf",
      "thermal-engine-normal.conf",
      "thermal-engine.conf"
    ],
    "mi_thermald": false,
    "services": [
      "thermal-engine",
      "thermalservice",
      "vendor.thermal-hal-1-0"
    ]
  }
}
