{
  "identity": {
    "android": "12",
    "brand": "Redmi",
    "codename": "excalibur",
    "model": "Redmi Note 9 Pro Max",
    "platform": "atoll"
  },
  "provenance": {
    "source_file": "devices/xiaomi/excalibur.prop"
  },
  "schema": "hico.device.v1",
  "source": {
    "kind": "oem-firmware-dump",
    "url": "https://dumps.tadiphone.dev/dumps/redmi/excalibur/-/tree/qssi-user-12-SKQ1.211019.001-V14.0.2.0.SJXINXM-release-keys"
  },
  "thermal": {
    "artifact_count": 4,
    "artifacts": [
      {
        "category": "thermal",
        "format": "thermal-engine-text",
        "max_trip_c": 61.0,
        "name": "thermal-engine-camera.conf",
        "parser": "thermal-engine-text-v2",
        "path": "devices/xiaomi/excalibur/thermal/thermal-engine-camera.conf",
        "sections": 7,
        "sha256": "07cac4c0ff74cd7aba8c5eff236adfb7ae7023aa92aa994602fb1e8cbf499f33",
        "shutdown_c": null,
        "size": 1340,
        "storage": "repository-artifact"
      },
      {
        "category": "thermal",
        "format": "thermal-engine-text",
        "max_trip_c": null,
        "name": "thermal-engine-map.conf",
        "parser": "thermal-engine-text-v2",
        "path": "devices/xiaomi/excalibur/thermal/thermal-engine-map.conf",
        "sections": 12,
        "sha256": "2510a6f562e9633614bf04e35d3b5a52aecd652cb7664ad2b7f2d911af13645b",
        "shutdown_c": null,
        "size": 378,
        "storage": "repository-artifact"
      },
      {
        "category": "thermal",
        "format": "thermal-engine-text",
        "max_trip_c": 61.0,
        "name": "thermal-engine-normal.conf",
        "parser": "thermal-engine-text-v2",
        "path": "devices/xiaomi/excalibur/thermal/thermal-engine-normal.conf",
        "sections": 7,
        "sha256": "24eba0156d866d47ca89e4a6c7f10860b62ea88d2d1d67005b00ce70cc18cafe",
        "shutdown_c": null,
        "size": 1363,
        "storage": "repository-artifact"
      },
      {
        "category": "thermal",
        "format": "text",
        "max_trip_c": null,
        "name": "thermal-engine.conf",
        "parser": null,
        "path": "devices/xiaomi/excalibur/thermal/thermal-engine.conf",
        "sections": 0,
        "sha256": "c32b39af7a19759a7db7f8b2d92d069a0534848aa7a195ca2cec24aa6c317cb3",
        "shutdown_c": null,
        "size": 84,
        "storage": "repository-artifact"
      }
    ],
    "config_names": [
      "thermal-engine-camera.conf",
      "thermal-engine-map.conf",
      "thermal-engine-normal.conf",
      "thermal-engine.conf"
    ],
    "mi_thermald": false,
    "services": [
      "thermal-engine"
    ]
  }
}
