{
  "identity": {
    "android": "13",
    "brand": "Redmi",
    "codename": "spes",
    "model": "spes",
    "platform": "bengal"
  },
  "provenance": {
    "source_file": "devices/xiaomi/spes.prop"
  },
  "schema": "hico.device.v1",
  "source": {
    "kind": "oem-firmware-dump",
    "url": "https://dumps.tadiphone.dev/dumps/redmi/spes/-/tree/missi_phoneext4_global-user-13-TKQ1.221114.001-V816.0.8.0.TGCMIXM-release-keys"
  },
  "thermal": {
    "artifact_count": 16,
    "artifacts": [
      {
        "category": "thermal",
        "format": "opaque-binary",
        "max_trip_c": null,
        "name": "thermal-4k.conf",
        "parser": null,
        "path": "devices/xiaomi/spes/thermal/thermal-4k.conf",
        "sections": 0,
        "sha256": "3bc4ae2947efeb0887cc95b8f8bc6e85a6eb06d3e098920ae2d6c8a3eefd998a",
        "shutdown_c": null,
        "size": 1328,
        "storage": "repository-artifact"
      },
      {
        "category": "thermal",
        "format": "opaque-binary",
        "max_trip_c": null,
        "name": "thermal-arvr.conf",
        "parser": null,
        "path": "devices/xiaomi/spes/thermal/thermal-arvr.conf",
        "sections": 0,
        "sha256": "ad33d097b8c5a5a32becbb02ce8be563174ea225e1503364b0a80d0d926f7fa6",
        "shutdown_c": null,
        "size": 1056,
        "storage": "repository-artifact"
      },
      {
        "category": "thermal",
        "format": "opaque-binary",
        "max_trip_c": null,
        "name": "thermal-camera.conf",
        "parser": null,
        "path": "devices/xiaomi/spes/thermal/thermal-camera.conf",
        "sections": 0,
        "sha256": "63bdc37cd0e4eb16123165fdb1323e6ec890f11483cdf632006c9871fdb233c9",
        "shutdown_c": null,
        "size": 1376,
        "storage": "repository-artifact"
      },
      {
        "category": "thermal",
        "format": "thermal-engine-text",
        "max_trip_c": 60.0,
        "name": "thermal-chg-only.conf",
        "parser": "thermal-engine-text-v2",
        "path": "devices/xiaomi/spes/thermal/thermal-chg-only.conf",
        "sections": 3,
        "sha256": "e3cdf0ecdaef6aa5b1d66d45e7b7be559f8d6eff07bb53a29a10c1d3c1496b4b",
        "shutdown_c": null,
        "size": 419,
        "storage": "repository-artifact"
      },
      {
        "category": "thermal",
        "format": "opaque-binary",
        "max_trip_c": null,
        "name": "thermal-class0.conf",
        "parser": null,
        "path": "devices/xiaomi/spes/thermal/thermal-class0.conf",
        "sections": 0,
        "sha256": "131c9e2570d682be1de61074208619f57d25d70bb969c561e07f984257669489",
        "shutdown_c": null,
        "size": 1392,
        "storage": "repository-artifact"
      },
      {
        "category": "thermal",
        "format": "text",
        "max_trip_c": null,
        "name": "thermal-engine.conf",
        "parser": null,
        "path": "devices/xiaomi/spes/thermal/thermal-engine.conf",
        "sections": 0,
        "sha256": "c32b39af7a19759a7db7f8b2d92d069a0534848aa7a195ca2cec24aa6c317cb3",
        "shutdown_c": null,
        "size": 84,
        "storage": "repository-artifact"
      },
      {
        "category": "thermal",
        "format": "opaque-binary",
        "max_trip_c": null,
        "name": "thermal-map.conf",
        "parser": null,
        "path": "devices/xiaomi/spes/thermal/thermal-map.conf",
        "sections": 0,
        "sha256": "9022fb8bf3dae9ecdca138e7266cedf63c75ee6dd1f64cf1c066d2b0ac1b5de4",
        "shutdown_c": null,
        "size": 448,
        "storage": "repository-artifact"
      },
      {
        "category": "thermal",
        "format": "opaque-binary",
        "max_trip_c": null,
        "name": "thermal-navigation.conf",
        "parser": null,
        "path": "devices/xiaomi/spes/thermal/thermal-navigation.conf",
        "sections": 0,
        "sha256": "34fe3204fff15fd99591d1a7595ff854577aef0743c8f2f63fd67d8f246063d8",
        "shutdown_c": null,
        "size": 1392,
        "storage": "repository-artifact"
      },
      {
        "category": "thermal",
        "format": "opaque-binary",
        "max_trip_c": null,
        "name": "thermal-nolimits.conf",
        "parser": null,
        "path": "devices/xiaomi/spes/thermal/thermal-nolimits.conf",
        "sections": 0,
        "sha256": "b6be5e0efaea023f921261b1664db11857df7cf38a0ee27f04c5c1b16d3d1be4",
        "shutdown_c": null,
        "size": 1040,
        "storage": "repository-artifact"
      },
      {
        "category": "thermal",
        "format": "opaque-binary",
        "max_trip_c": null,
        "name": "thermal-normal.conf",
        "parser": null,
        "path": "devices/xiaomi/spes/thermal/thermal-normal.conf",
        "sections": 0,
        "sha256": "5cb52bcba21af3b682d006ba9507ef1591646aeb63386e3e4e9dc8a0f2f9a9ed",
        "shutdown_c": null,
        "size": 1264,
        "storage": "repository-artifact"
      },
      {
        "category": "thermal",
        "format": "opaque-binary",
        "max_trip_c": null,
        "name": "thermal-phone.conf",
        "parser": null,
        "path": "devices/xiaomi/spes/thermal/thermal-phone.conf",
        "sections": 0,
        "sha256": "ed343c2b23361bce285518dafbafccc6e434cba504d0b6eab31cb30b88fb33ad",
        "shutdown_c": null,
        "size": 1184,
        "storage": "repository-artifact"
      },
      {
        "category": "thermal",
        "format": "opaque-binary",
        "max_trip_c": null,
        "name": "thermal-tgame.conf",
        "parser": null,
        "path": "devices/xiaomi/spes/thermal/thermal-tgame.conf",
        "sections": 0,
        "sha256": "faf7082a690a793ebc4b5d37031074653ff42fabdcbaf4d7c4a394a570cbedbf",
        "shutdown_c": null,
        "size": 1296,
        "storage": "repository-artifact"
      },
      {
        "category": "thermal",
        "format": "opaque-binary",
        "max_trip_c": null,
        "name": "thermal-video.conf",
        "parser": null,
        "path": "devices/xiaomi/spes/thermal/thermal-video.conf",
        "sections": 0,
        "sha256": "34fe3204fff15fd99591d1a7595ff854577aef0743c8f2f63fd67d8f246063d8",
        "shutdown_c": null,
        "size": 1392,
        "storage": "repository-artifact"
      },
      {
        "category": "thermal",
        "format": "opaque-binary",
        "max_trip_c": null,
        "name": "thermal-videochat.conf",
        "parser": null,
        "path": "devices/xiaomi/spes/thermal/thermal-videochat.conf",
        "sections": 0,
        "sha256": "074411c533a81f27139ced7534ad2be6f60d8627433c717b34b63f81e548f127",
        "shutdown_c": null,
        "size": 1504,
        "storage": "repository-artifact"
      },
      {
        "category": "thermal",
        "format": "opaque-binary",
        "max_trip_c": null,
        "name": "thermal-youtube.conf",
        "parser": null,
        "path": "devices/xiaomi/spes/thermal/thermal-youtube.conf",
        "sections": 0,
        "sha256": "f3901c29f3d5613d21f4b7a1f631bd9c09cbe23ad5c20f11f91b3ac1cfc9b879",
        "shutdown_c": null,
        "size": 1168,
        "storage": "repository-artifact"
      },
      {
        "category": "thermal",
        "format": "thermal-engine-text",
        "max_trip_c": null,
        "name": "thermald-devices.conf",
        "parser": "thermal-engine-text-v2",
        "path": "devices/xiaomi/spes/thermal/thermald-devices.conf",
        "sections": 0,
        "sha256": "d1cc3e0bc9ddcc0e1bd2f4978a67cd6438cb8fb9fbf025447ec7e5461e0a78f5",
        "shutdown_c": null,
        "size": 384,
        "storage": "repository-artifact"
      }
    ],
    "config_names": [
      "thermal-4k.conf",
      "thermal-arvr.conf",
      "thermal-camera.conf",
      "thermal-chg-only.conf",
      "thermal-class0.conf",
      "thermal-engine.conf",
      "thermal-map.conf",
      "thermal-navigation.conf",
      "thermal-nolimits.conf",
      "thermal-normal.conf",
      "thermal-phone.conf",
      "thermal-tgame.conf",
      "thermal-video.conf",
      "thermal-videochat.conf",
      "thermal-youtube.conf",
      "thermald-devices.conf"
    ],
    "mi_thermald": true,
    "services": [
      "mi_thermald"
    ]
  }
}
