{
  "identity": {
    "android": "13",
    "brand": "Qti",
    "codename": "veux",
    "model": "veux",
    "platform": "holi"
  },
  "provenance": {
    "source_file": "devices/xiaomi/veux.prop"
  },
  "schema": "hico.device.v1",
  "source": {
    "kind": "oem-firmware-dump",
    "url": "https://dumps.tadiphone.dev/dumps/redmi/veux/-/tree/missi_phoneext4_global-user-13-TKQ1.221114.001-V816.0.8.0.TKCMIXM-release-keys"
  },
  "thermal": {
    "artifact_count": 16,
    "artifacts": [
      {
        "category": "thermal",
        "format": "opaque-binary",
        "max_trip_c": null,
        "name": "thermal-arvr.conf",
        "parser": null,
        "path": "devices/xiaomi/veux/thermal/thermal-arvr.conf",
        "sections": 0,
        "sha256": "a086cecda0986d99d0172c1bde8ff46777b57715e0c41fca7bfc96b48f856f3e",
        "shutdown_c": null,
        "size": 1712,
        "storage": "repository-artifact"
      },
      {
        "category": "thermal",
        "format": "opaque-binary",
        "max_trip_c": null,
        "name": "thermal-camera.conf",
        "parser": null,
        "path": "devices/xiaomi/veux/thermal/thermal-camera.conf",
        "sections": 0,
        "sha256": "62a021fe579ee7fe2198dea8387b5ff3e95f7c23d827c7a0d4224441876d45f1",
        "shutdown_c": null,
        "size": 2256,
        "storage": "repository-artifact"
      },
      {
        "category": "thermal",
        "format": "opaque-binary",
        "max_trip_c": null,
        "name": "thermal-class0.conf",
        "parser": null,
        "path": "devices/xiaomi/veux/thermal/thermal-class0.conf",
        "sections": 0,
        "sha256": "daf34df5ac8f5af2d01294da4c8b32299d0f7ddf6544963bdb5693afb5230a81",
        "shutdown_c": null,
        "size": 1920,
        "storage": "repository-artifact"
      },
      {
        "category": "thermal",
        "format": "text",
        "max_trip_c": null,
        "name": "thermal-engine.conf",
        "parser": null,
        "path": "devices/xiaomi/veux/thermal/thermal-engine.conf",
        "sections": 0,
        "sha256": "c32b39af7a19759a7db7f8b2d92d069a0534848aa7a195ca2cec24aa6c317cb3",
        "shutdown_c": null,
        "size": 84,
        "storage": "repository-artifact"
      },
      {
        "category": "thermal",
        "format": "opaque-binary",
        "max_trip_c": null,
        "name": "thermal-extreme.conf",
        "parser": null,
        "path": "devices/xiaomi/veux/thermal/thermal-extreme.conf",
        "sections": 0,
        "sha256": "7031045003d7ff6710c9cdd86fd03a183b80ee0cfc836a7ca4ffc15e1a6d1f3b",
        "shutdown_c": null,
        "size": 4016,
        "storage": "repository-artifact"
      },
      {
        "category": "thermal",
        "format": "opaque-binary",
        "max_trip_c": null,
        "name": "thermal-high.conf",
        "parser": null,
        "path": "devices/xiaomi/veux/thermal/thermal-high.conf",
        "sections": 0,
        "sha256": "7031045003d7ff6710c9cdd86fd03a183b80ee0cfc836a7ca4ffc15e1a6d1f3b",
        "shutdown_c": null,
        "size": 4016,
        "storage": "repository-artifact"
      },
      {
        "category": "thermal",
        "format": "opaque-binary",
        "max_trip_c": null,
        "name": "thermal-map.conf",
        "parser": null,
        "path": "devices/xiaomi/veux/thermal/thermal-map.conf",
        "sections": 0,
        "sha256": "fb7002c1ea924b1faf536f8bf165020836fe9fd9fbc7765cfb7ee4d087fcadd5",
        "shutdown_c": null,
        "size": 304,
        "storage": "repository-artifact"
      },
      {
        "category": "thermal",
        "format": "opaque-binary",
        "max_trip_c": null,
        "name": "thermal-mgame.conf",
        "parser": null,
        "path": "devices/xiaomi/veux/thermal/thermal-mgame.conf",
        "sections": 0,
        "sha256": "b6d3057ef65199598bfadeb74dde680421e5e52cc999e4262b376fcbdd9829f7",
        "shutdown_c": null,
        "size": 1712,
        "storage": "repository-artifact"
      },
      {
        "category": "thermal",
        "format": "thermal-engine-text",
        "max_trip_c": 57.0,
        "name": "thermal-nevigation.conf",
        "parser": "thermal-engine-text-v2",
        "path": "devices/xiaomi/veux/thermal/thermal-nevigation.conf",
        "sections": 8,
        "sha256": "d6926ce92df07da5a4e88e886f1f23e3de0c0f9eac817272c71820133143155c",
        "shutdown_c": null,
        "size": 1981,
        "storage": "repository-artifact"
      },
      {
        "category": "thermal",
        "format": "opaque-binary",
        "max_trip_c": null,
        "name": "thermal-nolimits.conf",
        "parser": null,
        "path": "devices/xiaomi/veux/thermal/thermal-nolimits.conf",
        "sections": 0,
        "sha256": "7031045003d7ff6710c9cdd86fd03a183b80ee0cfc836a7ca4ffc15e1a6d1f3b",
        "shutdown_c": null,
        "size": 4016,
        "storage": "repository-artifact"
      },
      {
        "category": "thermal",
        "format": "opaque-binary",
        "max_trip_c": null,
        "name": "thermal-normal.conf",
        "parser": null,
        "path": "devices/xiaomi/veux/thermal/thermal-normal.conf",
        "sections": 0,
        "sha256": "4f9974a9e598db458cf936fb19913517cde42a71d7739644edb3d52480b3168c",
        "shutdown_c": null,
        "size": 2032,
        "storage": "repository-artifact"
      },
      {
        "category": "thermal",
        "format": "opaque-binary",
        "max_trip_c": null,
        "name": "thermal-phone.conf",
        "parser": null,
        "path": "devices/xiaomi/veux/thermal/thermal-phone.conf",
        "sections": 0,
        "sha256": "a91605ad69f587d45151c5a3d5eca294de2109f36f0fd7b05d1168723a8e85dd",
        "shutdown_c": null,
        "size": 1872,
        "storage": "repository-artifact"
      },
      {
        "category": "thermal",
        "format": "opaque-binary",
        "max_trip_c": null,
        "name": "thermal-tgame.conf",
        "parser": null,
        "path": "devices/xiaomi/veux/thermal/thermal-tgame.conf",
        "sections": 0,
        "sha256": "dfd6e094fedd770645c85722203d0b908161ba4924eaaebd66c3245842d04994",
        "shutdown_c": null,
        "size": 1920,
        "storage": "repository-artifact"
      },
      {
        "category": "thermal",
        "format": "opaque-binary",
        "max_trip_c": null,
        "name": "thermal-video.conf",
        "parser": null,
        "path": "devices/xiaomi/veux/thermal/thermal-video.conf",
        "sections": 0,
        "sha256": "a9c63d41e28dce604c6cb3b153e17e02b9f03e33df5bd38a3ebf47f5070b8c85",
        "shutdown_c": null,
        "size": 1888,
        "storage": "repository-artifact"
      },
      {
        "category": "thermal",
        "format": "opaque-binary",
        "max_trip_c": null,
        "name": "thermal-youtube.conf",
        "parser": null,
        "path": "devices/xiaomi/veux/thermal/thermal-youtube.conf",
        "sections": 0,
        "sha256": "2aaf63bfb33a7ef61deeb25de6591879d2e32c16406038dba8bed751c09ef2cc",
        "shutdown_c": null,
        "size": 1984,
        "storage": "repository-artifact"
      },
      {
        "category": "thermal",
        "format": "thermal-engine-text",
        "max_trip_c": null,
        "name": "thermald-devices.conf",
        "parser": "thermal-engine-text-v2",
        "path": "devices/xiaomi/veux/thermal/thermald-devices.conf",
        "sections": 0,
        "sha256": "d1cc3e0bc9ddcc0e1bd2f4978a67cd6438cb8fb9fbf025447ec7e5461e0a78f5",
        "shutdown_c": null,
        "size": 384,
        "storage": "repository-artifact"
      }
    ],
    "config_names": [
      "thermal-arvr.conf",
      "thermal-camera.conf",
      "thermal-class0.conf",
      "thermal-engine.conf",
      "thermal-extreme.conf",
      "thermal-high.conf",
      "thermal-map.conf",
      "thermal-mgame.conf",
      "thermal-nevigation.conf",
      "thermal-nolimits.conf",
      "thermal-normal.conf",
      "thermal-phone.conf",
      "thermal-tgame.conf",
      "thermal-video.conf",
      "thermal-youtube.conf",
      "thermald-devices.conf"
    ],
    "mi_thermald": true,
    "services": [
      "android.thermal-hal",
      "mi_thermald"
    ]
  }
}
