{
  "identity": {
    "android": "13",
    "brand": "Xiaomi",
    "codename": "zijin",
    "model": "Xiaomi Civi 1S",
    "platform": "lahaina"
  },
  "provenance": {
    "source_file": "devices/xiaomi/zijin.prop"
  },
  "schema": "hico.device.v1",
  "source": {
    "kind": "oem-firmware-dump",
    "url": "https://dumps.tadiphone.dev/dumps/xiaomi/zijin/-/tree/missi_phone_cn-user-13-TKQ1.220807.001-V13.2.5.0.TLPCNXM-release-keys"
  },
  "thermal": {
    "artifact_count": 18,
    "artifacts": [
      {
        "category": "thermal",
        "format": "opaque-binary",
        "max_trip_c": null,
        "name": "thermal-4k.conf",
        "parser": null,
        "path": "devices/xiaomi/zijin/thermal/thermal-4k.conf",
        "sections": 0,
        "sha256": "82f0359bf15b723bb53ba940096a02f3c45e0e8f665c9ed540ad34c45eb86a4c",
        "shutdown_c": null,
        "size": 2256,
        "storage": "repository-artifact"
      },
      {
        "category": "thermal",
        "format": "opaque-binary",
        "max_trip_c": null,
        "name": "thermal-8k.conf",
        "parser": null,
        "path": "devices/xiaomi/zijin/thermal/thermal-8k.conf",
        "sections": 0,
        "sha256": "ed989599a0dc91a06eca5555aca09b2ddd037cf2f8662e06b619bd17ae5cc2b4",
        "shutdown_c": null,
        "size": 2256,
        "storage": "repository-artifact"
      },
      {
        "category": "thermal",
        "format": "opaque-binary",
        "max_trip_c": null,
        "name": "thermal-camera.conf",
        "parser": null,
        "path": "devices/xiaomi/zijin/thermal/thermal-camera.conf",
        "sections": 0,
        "sha256": "ada6695e26b8bf10292cf3518579149183af4d66e0fedfeaf2810d7e2f46c525",
        "shutdown_c": null,
        "size": 2288,
        "storage": "repository-artifact"
      },
      {
        "category": "thermal",
        "format": "thermal-engine-text",
        "max_trip_c": 60.0,
        "name": "thermal-chg-only.conf",
        "parser": "thermal-engine-text-v2",
        "path": "devices/xiaomi/zijin/thermal/thermal-chg-only.conf",
        "sections": 4,
        "sha256": "615c57b0b8612e0c1dcb00d91a7a8bf5317be4a4805224129918047522775b98",
        "shutdown_c": null,
        "size": 912,
        "storage": "repository-artifact"
      },
      {
        "category": "thermal",
        "format": "opaque-binary",
        "max_trip_c": null,
        "name": "thermal-class0.conf",
        "parser": null,
        "path": "devices/xiaomi/zijin/thermal/thermal-class0.conf",
        "sections": 0,
        "sha256": "9104b704207c843c7c62a01623d04f037cd81044ef66beeb9a435fe6e5191e58",
        "shutdown_c": null,
        "size": 2528,
        "storage": "repository-artifact"
      },
      {
        "category": "thermal",
        "format": "text",
        "max_trip_c": null,
        "name": "thermal-engine.conf",
        "parser": null,
        "path": "devices/xiaomi/zijin/thermal/thermal-engine.conf",
        "sections": 0,
        "sha256": "c32b39af7a19759a7db7f8b2d92d069a0534848aa7a195ca2cec24aa6c317cb3",
        "shutdown_c": null,
        "size": 84,
        "storage": "repository-artifact"
      },
      {
        "category": "thermal",
        "format": "opaque-binary",
        "max_trip_c": null,
        "name": "thermal-huanji.conf",
        "parser": null,
        "path": "devices/xiaomi/zijin/thermal/thermal-huanji.conf",
        "sections": 0,
        "sha256": "4ee7773f70de4856979f2950506060fa61c0b911b4209075ab578f1371407428",
        "shutdown_c": null,
        "size": 2448,
        "storage": "repository-artifact"
      },
      {
        "category": "thermal",
        "format": "opaque-binary",
        "max_trip_c": null,
        "name": "thermal-map.conf",
        "parser": null,
        "path": "devices/xiaomi/zijin/thermal/thermal-map.conf",
        "sections": 0,
        "sha256": "7fb7331f65dac75153ad1ed938e5e66ee4942fc5c25da7581b3e4f052c4bd054",
        "shutdown_c": null,
        "size": 2080,
        "storage": "repository-artifact"
      },
      {
        "category": "thermal",
        "format": "opaque-binary",
        "max_trip_c": null,
        "name": "thermal-mgame.conf",
        "parser": null,
        "path": "devices/xiaomi/zijin/thermal/thermal-mgame.conf",
        "sections": 0,
        "sha256": "b05b103214672da4a0940418837456405f9a22ba5a83cea213ca35cc4d2fbbd0",
        "shutdown_c": null,
        "size": 2064,
        "storage": "repository-artifact"
      },
      {
        "category": "thermal",
        "format": "opaque-binary",
        "max_trip_c": null,
        "name": "thermal-navigation.conf",
        "parser": null,
        "path": "devices/xiaomi/zijin/thermal/thermal-navigation.conf",
        "sections": 0,
        "sha256": "4cf2bc77c90724d06bf879c602ddc00aa1c516958acd74c8dcfa563e83a65fde",
        "shutdown_c": null,
        "size": 2384,
        "storage": "repository-artifact"
      },
      {
        "category": "thermal",
        "format": "opaque-binary",
        "max_trip_c": null,
        "name": "thermal-nolimits.conf",
        "parser": null,
        "path": "devices/xiaomi/zijin/thermal/thermal-nolimits.conf",
        "sections": 0,
        "sha256": "b59df2b9bebff58a5904833bc6362de7cacfb4d9b2691c68885752c3720b02a7",
        "shutdown_c": null,
        "size": 688,
        "storage": "repository-artifact"
      },
      {
        "category": "thermal",
        "format": "opaque-binary",
        "max_trip_c": null,
        "name": "thermal-normal.conf",
        "parser": null,
        "path": "devices/xiaomi/zijin/thermal/thermal-normal.conf",
        "sections": 0,
        "sha256": "2d64fdab6f9e37f46f388f36d2b70eab9286e38d0f71b8272c9aded2bb89b636",
        "shutdown_c": null,
        "size": 2912,
        "storage": "repository-artifact"
      },
      {
        "category": "thermal",
        "format": "opaque-binary",
        "max_trip_c": null,
        "name": "thermal-phone.conf",
        "parser": null,
        "path": "devices/xiaomi/zijin/thermal/thermal-phone.conf",
        "sections": 0,
        "sha256": "07ddca49836ccccf978730a7904c281d1ee49232382c758e9e498171bd86886c",
        "shutdown_c": null,
        "size": 1984,
        "storage": "repository-artifact"
      },
      {
        "category": "thermal",
        "format": "opaque-binary",
        "max_trip_c": null,
        "name": "thermal-tgame.conf",
        "parser": null,
        "path": "devices/xiaomi/zijin/thermal/thermal-tgame.conf",
        "sections": 0,
        "sha256": "551aea0d48e9d025ebff0a86f93990a27d3e26b8bb16f371fadd6ae29969d4b9",
        "shutdown_c": null,
        "size": 2064,
        "storage": "repository-artifact"
      },
      {
        "category": "thermal",
        "format": "opaque-binary",
        "max_trip_c": null,
        "name": "thermal-video.conf",
        "parser": null,
        "path": "devices/xiaomi/zijin/thermal/thermal-video.conf",
        "sections": 0,
        "sha256": "631bc6289cc984cb5cda62f8e8fdabc3a15cfacdb0fde2ea8f4e8e40d8a4e1eb",
        "shutdown_c": null,
        "size": 2544,
        "storage": "repository-artifact"
      },
      {
        "category": "thermal",
        "format": "opaque-binary",
        "max_trip_c": null,
        "name": "thermal-videochat.conf",
        "parser": null,
        "path": "devices/xiaomi/zijin/thermal/thermal-videochat.conf",
        "sections": 0,
        "sha256": "c6187e6089a0ca6d2cd8ee5afab013094ab05a8e40867007d01e2622f691481b",
        "shutdown_c": null,
        "size": 2288,
        "storage": "repository-artifact"
      },
      {
        "category": "thermal",
        "format": "opaque-binary",
        "max_trip_c": null,
        "name": "thermal-youtube.conf",
        "parser": null,
        "path": "devices/xiaomi/zijin/thermal/thermal-youtube.conf",
        "sections": 0,
        "sha256": "7474ca7b6956505cdf8a2a882e713b3daecb04af0fbc1e6cf20a08dfde8cb841",
        "shutdown_c": null,
        "size": 2480,
        "storage": "repository-artifact"
      },
      {
        "category": "thermal",
        "format": "thermal-engine-text",
        "max_trip_c": null,
        "name": "thermald-devices.conf",
        "parser": "thermal-engine-text-v2",
        "path": "devices/xiaomi/zijin/thermal/thermald-devices.conf",
        "sections": 0,
        "sha256": "f5bca0ceb241804654cf6c13f6c07077e0750bbda462c77df84ed762e82a652e",
        "shutdown_c": null,
        "size": 1305,
        "storage": "repository-artifact"
      }
    ],
    "config_names": [
      "thermal-4k.conf",
      "thermal-8k.conf",
      "thermal-camera.conf",
      "thermal-chg-only.conf",
      "thermal-class0.conf",
      "thermal-engine.conf",
      "thermal-huanji.conf",
      "thermal-map.conf",
      "thermal-mgame.conf",
      "thermal-navigation.conf",
      "thermal-nolimits.conf",
      "thermal-normal.conf",
      "thermal-phone.conf",
      "thermal-tgame.conf",
      "thermal-video.conf",
      "thermal-videochat.conf",
      "thermal-youtube.conf",
      "thermald-devices.conf"
    ],
    "mi_thermald": true,
    "services": [
      "android.thermal-hal",
      "mi_thermald"
    ]
  }
}
