{
  "identity": {
    "android": "8.1.0",
    "brand": "Xiaomi",
    "codename": "tissot_sprout",
    "model": "Mi A1",
    "platform": "msm8953"
  },
  "provenance": {
    "source_file": "devices/xiaomi/tissot_sprout.prop"
  },
  "schema": "hico.device.v1",
  "source": {
    "kind": "oem-firmware-dump",
    "url": "https://dumps.tadiphone.dev/dumps/xiaomi/tissot/-/tree/tissot-user-8.1.0-OPM1.171019.026-V9.6.5.0.ODHMIFE-release-keys"
  },
  "thermal": {
    "artifact_count": 0,
    "artifacts": [],
    "config_names": [],
    "mi_thermald": false,
    "services": []
  }
}
